{
  "task": "2a.2",
  "changed": "Owner gate G1 recorded (commit 64ca921, 'docs(adr): accept Phase 2 ADRs 0024, 0025, 0027-0029'): ADRs 0024, 0025, 0027, 0028 and 0029 Accepted (owner, 2026-10-18) in each ADR and the index; target 6.4 status says accepted and stays [P] until implemented; owner decisions D6, D7 and D8 confirmed at their defaults in the plan; the plan's Part 2a boxes ticked; roadmap Phase 2 row: ADRs accepted, current part 2b; stale 'Proposed' mentions of ADRs 0025 and 0028 in target 4.x, C6, C8 and C11 updated.",
  "evidence_refs": [
    "harness/state/evidence/gates/2a.2/2026-10-18T00-51-00.067907+00-00-full.json"
  ],
  "open_items": [
    "Task 2b.1 (Profile.features and the off-mode golden baseline) is next; 2c starts after 2b.",
    "Push of phase2/execution-ir and its PR wait for the owner."
  ],
  "rulings": [
    {
      "ruling": "Target 6.4 keeps its [P] tag after acceptance, because the legend defines [P] as designed and awaiting implementation; only its status sentence changed.",
      "cost_if_wrong": "A one-word tag change."
    }
  ],
  "outside_repo": [
    {
      "change": "PR #5 merged to main as 008471a on the owner's instruction; CI green on main.",
      "undo": "Revert the merge commit on main."
    }
  ]
}